Topic,Article_Name
1,conversations with the news co-speculation into conversational interactions with news content,design ideation with ai-sketching thinking and talking with generative machine learning models,how to use generative ai as a design material for future human-computer (co-) creation,memory manipulations in extended reality,message ritual a posthuman account of living with lamp,miracle machine in the making soulful speculation with kabbalah,nine potential pitfalls when designing human-ai co-creative systems,objective portrait a practice-based inquiry to explore al as a reflective design partner,probing respiratory care with generative deep learning,responsible language technologies foreseeing and mitigating harms,the entoptic field camera as metaphor-driven research-through-design with ai technologies,the future of generative ai how genai would change human-computer co-creation in the next 10 to 15 years,what is human-centered about human-centered ai a map of the research landscape
2,Artificial Intelligence and Creativity,Investigating Consumer Perception and Speculative AI Labels for Creative AI Usage In Media,boosting children's creativity through creative interactions with social robots,machines for living,memento flori speculative design approaches to memorials of the future,sparking creativity with robots a design perspective
3,ai-generated dance and the subjectivity challenge,artistic fusion- exploring the potential of ai-generated artwork in enabling creative expression with people with intellectual disabilities,designing with ai- a user study to explore the future role of ai as a collaborative tool in graphics design,drinking chai with your (ai) programming partner a design fiction about generative ai for software engineering,embodying an interactive ai for dance through movement ideation,filmmaking of the future a co-design-led investigation into the potential of immersive technologies to enhance the small and medium audiovisual production,hidden layer interaction a co-creative design fiction for generative models,participatory conceptual design of accessible digital musical instruments using generative ai,writers want ai collaborators to respect their personal values and writing strategies a human-centered perspective on ai co-writing
4,A Speculative Exploration of the Role of Dialogue in Human-Computer Co-creation,Call for Speculative ICCC,Exploration of the Future of Co-Creative Systems Through Collaborative Speculative Design Practices,Predictive or Imaginative Futures,intelligent music performance system towards a design framework,on the integration of machine agents into live coding,prototyping relational things that talk a discursive design strategy for conversational ai systems
5,"Algorithmic Abduction Robots","Exploring the Human-AI Nexus- A Friendly Dispute Between Second-Order Cybernetical Ethical Thinking and Questions of AI Ethics","Instituting socio-technical education futures encounters with through technical democracy, data justice, and imaginaries","Lonely Road Maison 2021 preprint","Public Interest Technology Indian Megacities","The Future of HCI-Policy Collaboration","World Yearbook of Education 2024 Digi... (Z-Library) (dragged)","_explorers of unknown planets practices and politics of artificial intelligence in visual arts","ahrc design fellows challenges of the future ai data","ai in the public eye investigating public ai literacy through ai art","deepfakes in india from words for the lies to the faces for the lies","dreams for digital spaces symposium paper what shapes the worlds of children educators and researchers","experiential speculation in vision-based ai design education designing conventional and progressive ai futures","festforward participatory design futuring and world-building for equitable digital futures in performing arts festivals","from ban it till we understand it to resistance is futile how university programming instructors plan to adapt as more students use ai code generation and","from critical technical practice to reflexive data science","generative ai futures a speculative design exploration","humans will lose proper imagination unconsciously","imagining the future of creative ai tools a cospeculative workshop","its like the value system in the loop domain experts values expectations for nlp automation","lost in the logistical funhouse speculative design as synthetic media enterprise","machine talking speculative conversations with ai through practice-oriented research","metaverse perspectives from japan a participatory speculative design case study","muGen — Generative AI as Machinic Exploration of Cultural Archives","nishant shah","rendering a better future (L Shape)","speculation forms and functions","speculative mobility exploring sustainability-driven scenarios for future car owners","synthetic ethnography field devices for the qualitative study of generative models","unpredictable memes speculative futures of meme creators ownership through the lens of disruptive technologies","unreliable narrator reparative approaches to harmful biases in ai storytelling for the he classroom and future creative industries","user perspectives of the ethical dilemmas of ownership accountability leadership in human-ai co-creation","when happy accidents spark creativity bringing collaborative speculation to life with generative ai"
