Topic,Article_Name
1,humans will lose proper imagination unconsciously,message ritual a posthuman account of living with lamp,speculation forms and functions
2,rendering a better future (L Shape)
3,Lonely Road Maison 2021 preprint,deepfakes in india from words for the lies to the faces for the lies,from critical technical practice to reflexive data science
4,Call for Speculative ICCC,Exploration of the Future of Co-Creative Systems Through Collaborative Speculative Design Practices,Investigating Consumer Perception and Speculative AI Labels for Creative AI Usage In Media,design ideation with ai-sketching thinking and talking with generative machine learning models,designing with ai- a user study to explore the future role of ai as a collaborative tool in graphics design,how to use generative ai as a design material for future human-computer (co-) creation,imagining the future of creative ai tools a cospeculative workshop,participatory conceptual design of accessible digital musical instruments using generative ai,user perspectives of the ethical dilemmas of ownership accountability leadership in human-ai co-creation
5,Exploring the Human-AI Nexus- A Friendly Dispute Between Second-Order Cybernetical Ethical Thinking and Questions of AI Ethics,intelligent music performance system towards a design framework,nishant shah,unreliable narrator reparative approaches to harmful biases in ai storytelling for the he classroom and future creative industries
6,The Future of HCI-Policy Collaboration
7,Algorithmic Abduction Robots,generative ai futures a speculative design exploration,hidden layer interaction a co-creative design fiction for generative models,lost in the logistical funhouse speculative design as synthetic media enterprise,muGen — Generative AI as Machinic Exploration of Cultural Archives,objective portrait a practice-based inquiry to explore al as a reflective design partner,synthetic ethnography field devices for the qualitative study of generative models,when happy accidents spark creativity bringing collaborative speculation to life with generative ai
8,ahrc design fellows challenges of the future ai data,drinking chai with your (ai) programming partner a design fiction about generative ai for software engineering,miracle machine in the making soulful speculation with kabbalah
9,"Instituting socio-technical education futures encounters with through technical democracy, data justice, and imaginaries","World Yearbook of Education 2024 Digi... (Z-Library) (dragged)","dreams for digital spaces symposium paper what shapes the worlds of children educators and researchers","experiential speculation in vision-based ai design education designing conventional and progressive ai futures"
10,ai in the public eye investigating public ai literacy through ai art
11,A Speculative Exploration of the Role of Dialogue in Human-Computer Co-creation,Artificial Intelligence and Creativity,_explorers of unknown planets practices and politics of artificial intelligence in visual arts,artistic fusion- exploring the potential of ai-generated artwork in enabling creative expression with people with intellectual disabilities
12,memory manipulations in extended reality,on the integration of machine agents into live coding
14,nine potential pitfalls when designing human-ai co-creative systems,responsible language technologies foreseeing and mitigating harms,the future of generative ai how genai would change human-computer co-creation in the next 10 to 15 years,what is human-centered about human-centered ai a map of the research landscape
15,its like the value system in the loop domain experts values expectations for nlp automation,the entoptic field camera as metaphor-driven research-through-design with ai technologies
16,filmmaking of the future a co-design-led investigation into the potential of immersive technologies to enhance the small and medium audiovisual production
17,from ban it till we understand it to resistance is futile how university programming instructors plan to adapt as more students use ai code generation and,machine talking speculative conversations with ai through practice-oriented research
18,festforward participatory design futuring and world-building for equitable digital futures in performing arts festivals,unpredictable memes speculative futures of meme creators ownership through the lens of disruptive technologies
19,speculative mobility exploring sustainability-driven scenarios for future car owners
20,machines for living,memento flori speculative design approaches to memorials of the future
21,Predictive or Imaginative Futures,Public Interest Technology Indian Megacities,conversations with the news co-speculation into conversational interactions with news content,metaverse perspectives from japan a participatory speculative design case study
22,ai-generated dance and the subjectivity challenge,embodying an interactive ai for dance through movement ideation,writers want ai collaborators to respect their personal values and writing strategies a human-centered perspective on ai co-writing
23,boosting children's creativity through creative interactions with social robots,sparking creativity with robots a design perspective
24,prototyping relational things that talk a discursive design strategy for conversational ai systems
25,probing respiratory care with generative deep learning
