Topic,Article_Name
1,A Speculative Exploration of the Role of Dialogue in Human-Computer Co-creation,Call for Speculative ICCC,ahrc design fellows challenges of the future ai data,design ideation with ai-sketching thinking and talking with generative machine learning models,experiential speculation in vision-based ai design education designing conventional and progressive ai futures,festforward participatory design futuring and world-building for equitable digital futures in performing arts festivals,generative ai futures a speculative design exploration,how to use generative ai as a design material for future human-computer (co-) creation,intelligent music performance system towards a design framework,nine potential pitfalls when designing human-ai co-creative systems,objective portrait a practice-based inquiry to explore al as a reflective design partner
2,Exploration of the Future of Co-Creative Systems Through Collaborative Speculative Design Practices,artistic fusion- exploring the potential of ai-generated artwork in enabling creative expression with people with intellectual disabilities,designing with ai- a user study to explore the future role of ai as a collaborative tool in graphics design,imagining the future of creative ai tools a cospeculative workshop,participatory conceptual design of accessible digital musical instruments using generative ai,user perspectives of the ethical dilemmas of ownership accountability leadership in human-ai co-creation
3,"Instituting socio-technical education futures encounters with through technical democracy, data justice, and imaginaries","World Yearbook of Education 2024 Digi... (Z-Library) (dragged)","dreams for digital spaces symposium paper what shapes the worlds of children educators and researchers","speculation forms and functions"
4,Investigating Consumer Perception and Speculative AI Labels for Creative AI Usage In Media,Lonely Road Maison 2021 preprint,humans will lose proper imagination unconsciously
5,Exploring the Human-AI Nexus- A Friendly Dispute Between Second-Order Cybernetical Ethical Thinking and Questions of AI Ethics,_explorers of unknown planets practices and politics of artificial intelligence in visual arts,drinking chai with your (ai) programming partner a design fiction about generative ai for software engineering,its like the value system in the loop domain experts values expectations for nlp automation,lost in the logistical funhouse speculative design as synthetic media enterprise,nishant shah,synthetic ethnography field devices for the qualitative study of generative models,unreliable narrator reparative approaches to harmful biases in ai storytelling for the he classroom and future creative industries
6,Artificial Intelligence and Creativity,ai in the public eye investigating public ai literacy through ai art,from critical technical practice to reflexive data science,muGen — Generative AI as Machinic Exploration of Cultural Archives
7,Algorithmic Abduction Robots,deepfakes in india from words for the lies to the faces for the lies,machines for living
8,rendering a better future (L Shape),speculative mobility exploring sustainability-driven scenarios for future car owners
9,The Future of HCI-Policy Collaboration
10,the entoptic field camera as metaphor-driven research-through-design with ai technologies,unpredictable memes speculative futures of meme creators ownership through the lens of disruptive technologies,when happy accidents spark creativity bringing collaborative speculation to life with generative ai
11,machine talking speculative conversations with ai through practice-oriented research
12,memory manipulations in extended reality,message ritual a posthuman account of living with lamp,miracle machine in the making soulful speculation with kabbalah,on the integration of machine agents into live coding,responsible language technologies foreseeing and mitigating harms,the future of generative ai how genai would change human-computer co-creation in the next 10 to 15 years,what is human-centered about human-centered ai a map of the research landscape
13,metaverse perspectives from japan a participatory speculative design case study,prototyping relational things that talk a discursive design strategy for conversational ai systems
14,Predictive or Imaginative Futures,Public Interest Technology Indian Megacities,conversations with the news co-speculation into conversational interactions with news content
15,filmmaking of the future a co-design-led investigation into the potential of immersive technologies to enhance the small and medium audiovisual production
16,probing respiratory care with generative deep learning
17,memento flori speculative design approaches to memorials of the future
18,from ban it till we understand it to resistance is futile how university programming instructors plan to adapt as more students use ai code generation and,writers want ai collaborators to respect their personal values and writing strategies a human-centered perspective on ai co-writing
19,ai-generated dance and the subjectivity challenge,embodying an interactive ai for dance through movement ideation,hidden layer interaction a co-creative design fiction for generative models
20,boosting children's creativity through creative interactions with social robots,sparking creativity with robots a design perspective
